{
  "$schema": "https://flaggo.dev/contracts/schemas/service-observability-profile-v1.schema.json",
  "profile": "flaggo.service-observability",
  "version": "1.0.0",
  "schemaUrl": {
    "reserved": "https://flaggo.dev/schemas/service-observability/1.0.0",
    "emit": false
  },
  "export": {
    "protocol": "http/protobuf",
    "signals": [
      "logs",
      "metrics",
      "traces"
    ],
    "consoleLogs": true,
    "enablement": "configured-endpoint",
    "endpointEnvironmentVariables": [
      "OTEL_EXPORTER_OTLP_ENDPOINT",
      "OTEL_EXPORTER_OTLP_LOGS_ENDPOINT",
      "OTEL_EXPORTER_OTLP_METRICS_ENDPOINT",
      "OTEL_EXPORTER_OTLP_TRACES_ENDPOINT"
    ],
    "invalidConfiguration": "fail-startup",
    "unavailableBackend": "degrade-without-domain-failure",
    "queue": "bounded",
    "shutdownFlush": "bounded",
    "ingestionSelfExport": "reject-own-local-receiver"
  },
  "resource": {
    "requiredAttributes": [
      {
        "name": "service.name",
        "type": "string",
        "source": "fixed-by-binary",
        "cardinality": "fixed",
        "description": "Stable executable identity such as flaggo-decision-service."
      },
      {
        "name": "service.namespace",
        "type": "string",
        "source": "fixed-by-binary",
        "cardinality": "fixed",
        "description": "Always flaggo for Flaggo-owned service telemetry."
      },
      {
        "name": "service.version",
        "type": "string",
        "source": "assembly-or-package",
        "cardinality": "bounded",
        "description": "Assembly or Cargo package version of the running service."
      },
      {
        "name": "service.instance.id",
        "type": "string",
        "source": "configured-or-generated-per-process",
        "cardinality": "unbounded",
        "description": "One stable identifier for the lifetime of one service process."
      }
    ],
    "optionalAttributes": [
      {
        "name": "deployment.environment.name",
        "type": "string",
        "source": "optional-standard-resource",
        "cardinality": "bounded",
        "description": "Operator-defined deployment environment using the standard OpenTelemetry Resource attribute."
      }
    ],
    "forbiddenAttributes": [
      "flaggo.tenant",
      "flaggo.application",
      "flaggo.environment"
    ]
  },
  "scopes": [
    {
      "name": "flaggo.contract-service",
      "signals": [
        "logs",
        "metrics",
        "traces"
      ],
      "description": "Contract acceptance, reads, Candidate admission, and activation authority."
    },
    {
      "name": "flaggo.decision-service",
      "signals": [
        "logs",
        "metrics",
        "traces"
      ],
      "description": "Exact-version runtime resolution and deterministic evaluation."
    },
    {
      "name": "flaggo.otel-ingestion",
      "signals": [
        "logs",
        "metrics",
        "traces"
      ],
      "description": "OTLP request validation, durable append, health, and inbox retention."
    },
    {
      "name": "flaggo.evidence-materializer",
      "signals": [
        "logs",
        "metrics",
        "traces"
      ],
      "description": "Forward materialization, catalog refresh, checkpoint, backlog, and freshness."
    },
    {
      "name": "flaggo.async-analysis",
      "signals": [
        "logs",
        "metrics",
        "traces"
      ],
      "description": "Analysis scheduling, claims, live evidence queries, agent runs, and Candidate proposals."
    }
  ],
  "attributes": [
    {
      "name": "flaggo.request.correlation_id",
      "type": "string",
      "cardinality": "unbounded",
      "classification": "correlation-identifier",
      "metricDimension": false,
      "description": "Validated X-Flaggo-Correlation-Id value recorded on request spans and logs."
    },
    {
      "name": "flaggo.contract.name",
      "type": "string",
      "cardinality": "unbounded",
      "classification": "domain-identifier",
      "metricDimension": false,
      "description": "Logical DecisionContract name, recorded whenever an operation identifies a contract."
    },
    {
      "name": "flaggo.contract.digest",
      "type": "string",
      "cardinality": "unbounded",
      "classification": "domain-identifier",
      "metricDimension": false,
      "description": "Exact immutable contract digest, recorded whenever an operation targets or resolves one version."
    },
    {
      "name": "flaggo.executable.digest",
      "type": "string",
      "cardinality": "unbounded",
      "classification": "domain-identifier",
      "metricDimension": false,
      "description": "Exact immutable executable digest when runtime authority is resolved or changed."
    },
    {
      "name": "flaggo.candidate.digest",
      "type": "string",
      "cardinality": "unbounded",
      "classification": "domain-identifier",
      "metricDimension": false,
      "description": "Exact Candidate digest when admission or activation identifies a Candidate."
    },
    {
      "name": "flaggo.activation.superseded_count",
      "type": "int64",
      "cardinality": "unbounded",
      "classification": "aggregate",
      "metricDimension": false,
      "description": "Number of pending analysis Candidates made inactive by one activation resolution."
    },
    {
      "name": "flaggo.batch.id",
      "type": "string",
      "cardinality": "unbounded",
      "classification": "domain-identifier",
      "metricDimension": false,
      "description": "Raw OTLP Inbox batch identity for one materialization page or diagnostic."
    },
    {
      "name": "flaggo.analysis.cycle.id",
      "type": "string",
      "cardinality": "unbounded",
      "classification": "domain-identifier",
      "metricDimension": false,
      "description": "Exact durable analysis-cycle identity."
    },
    {
      "name": "flaggo.analysis.attempt.id",
      "type": "string",
      "cardinality": "unbounded",
      "classification": "domain-identifier",
      "metricDimension": false,
      "description": "Exact analysis-agent attempt identity."
    },
    {
      "name": "flaggo.analysis.action.id",
      "type": "string",
      "cardinality": "unbounded",
      "classification": "correlation-identifier",
      "metricDimension": false,
      "description": "Generated UUID for one observed action; retries use distinct identities."
    },
    {
      "name": "flaggo.analysis.action.kind",
      "type": "string",
      "cardinality": "bounded",
      "classification": "bounded-operation",
      "metricDimension": false,
      "allowedValues": [
        "session.start",
        "session.run",
        "provider.request",
        "evidence.describe",
        "evidence.sql",
        "python.run",
        "artifact.read",
        "artifact.write",
        "artifact.append",
        "proposal.submit"
      ],
      "description": "Trusted execution boundary, not agent-authored narration or an inferred reasoning state."
    },
    {
      "name": "flaggo.analysis.action.outcome",
      "type": "string",
      "cardinality": "bounded",
      "classification": "bounded-outcome",
      "metricDimension": false,
      "allowedValues": [
        "running",
        "success",
        "failed",
        "timeout",
        "cancelled",
        "interrupted",
        "superseded",
        "handoff",
        "no_change",
        "no_candidate"
      ],
      "description": "Observed action state. Missing terminal telemetry is unknown, not a terminal outcome."
    },
    {
      "name": "flaggo.analysis.action.duration_ms",
      "type": "int64",
      "cardinality": "unbounded",
      "classification": "aggregate",
      "metricDimension": false,
      "description": "Nonnegative monotonic-clock duration measured at the emitting boundary."
    },
    {
      "name": "flaggo.analysis.query.digest",
      "type": "string",
      "cardinality": "unbounded",
      "classification": "domain-identifier",
      "metricDimension": false,
      "description": "SHA-256 digest of requested SQL; never SQL text or query parameters."
    },
    {
      "name": "flaggo.analysis.result.rows",
      "type": "int64",
      "cardinality": "unbounded",
      "classification": "aggregate",
      "metricDimension": false,
      "description": "Number of rows actually returned by a successful SQL query, not observations scanned."
    },
    {
      "name": "flaggo.analysis.result.bytes",
      "type": "int64",
      "cardinality": "unbounded",
      "classification": "aggregate",
      "metricDimension": false,
      "description": "Actual query result bytes or artifact content bytes at the observed boundary; never payload content."
    },
    {
      "name": "flaggo.analysis.artifact.digest",
      "type": "string",
      "cardinality": "unbounded",
      "classification": "domain-identifier",
      "metricDimension": false,
      "description": "SHA-256 of successfully read/written content or appended fragment, not the resulting complete file after append; no raw path or content."
    },
    {
      "name": "flaggo.analysis.tool_call.id",
      "type": "string",
      "cardinality": "unbounded",
      "classification": "correlation-identifier",
      "metricDimension": false,
      "description": "Provider tool-call identity when observed; bounded ASCII identity of at most 128 bytes."
    },
    {
      "name": "flaggo.analysis.session.id",
      "type": "string",
      "cardinality": "unbounded",
      "classification": "correlation-identifier",
      "metricDimension": false,
      "description": "SHA-256 reference to a provider session when observed; no raw provider payload."
    },
    {